title,album,artist,id,url
Another Dream Of You,Another Dream Of You,"Weston & Teston, Phorie",6i8LxKp2Lwxie1ZVdNthKC,https://open.spotify.com/track/6i8LxKp2Lwxie1ZVdNthKC
Sanctum (feat. Marion Di Napoli),Sanctum EP,"Charlotte de Witte, Marion Di Napoli",43smiSsmoONd2gAXBqJKVj,https://open.spotify.com/track/43smiSsmoONd2gAXBqJKVj
Tiger Claw,Tiger Claw,HOF,7n0GhbTRJuENvGcfvgQdS4,https://open.spotify.com/track/7n0GhbTRJuENvGcfvgQdS4
Lost in Space,Lost in Space,"Konstantin Sibold, KAF3R",2Qn6K6ytz5O3ckq4pH6oV3,https://open.spotify.com/track/2Qn6K6ytz5O3ckq4pH6oV3
Your Loving Arms - Simon Patterson Remix,Your Loving Arms (Simon Patterson Remix),"Karen Overton, Simon Patterson",2lkvps0CAvUczqu8z9dsd6,https://open.spotify.com/track/2lkvps0CAvUczqu8z9dsd6
