title,album,artist,id,url
Clone - HIGHSOCIETY Remix,Clone (HIGHSOCIETY Remix),"Teddy Killerz, Celldweller, HIGHSOCIETY",0EEACljZc8nCsAvKkGSAnG,https://open.spotify.com/track/0EEACljZc8nCsAvKkGSAnG
Circle,Circle,"Toronto Is Broken, Sebotage",2aTXg7Ch2EuKpa7m8Z8GSv,https://open.spotify.com/track/2aTXg7Ch2EuKpa7m8Z8GSv
Pressure,Pressure,"Toronto Is Broken, Deuce & Charger",0bMWhXMZ6trIHW0FfxYFyQ,https://open.spotify.com/track/0bMWhXMZ6trIHW0FfxYFyQ
Drown,Drown,"Psylla, Sarah de Warren",4oJ0MwLNZEqRvwgwEfsl0a,https://open.spotify.com/track/4oJ0MwLNZEqRvwgwEfsl0a
The Underground,Underground,"Social Kid, Micah Martin",5f2eLg7qEM84upTOuOMJtJ,https://open.spotify.com/track/5f2eLg7qEM84upTOuOMJtJ
