# idk, By Drew Achtermann, https://open.spotify.com/playlist/6Hj3esks8RqBcXLcpjNZpW
title,album,artist,id,url
The Crypt (feat. Khadfi Dub) - Original Mix,Monsters Vol. 4,"Figure, Khadfi Dub",1TW1K2OGqva989zNkSxVRI,https://open.spotify.com/track/1TW1K2OGqva989zNkSxVRI
Summer Ashes - Summer Ashes Kevin Drew VIP Remix,Summer Ashes (Remix Compilation),"Kevin Drew, Taryn Manning",78e6AeFSgr1fug1fGHaFzw,https://open.spotify.com/track/78e6AeFSgr1fug1fGHaFzw
Walk In The Fire,Irreverence,Dirtyphonics,2nOA8ScmrINo4CF7GHXnTx,https://open.spotify.com/track/2nOA8ScmrINo4CF7GHXnTx
Speak (feat. Mickey Shiloh),Speak,"Corporate, Mickey Shiloh",5qJRSAR0FwUk1hJb5RKpqN,https://open.spotify.com/track/5qJRSAR0FwUk1hJb5RKpqN
