# idk2, By Drew Achtermann, https://open.spotify.com/playlist/0KMUtdJWIYpA7Yusq0eK46
title,album,artist,id,url
SYNTHESIZE,SYNTHESIZE,KLOUD,1l06BAA8vssAu35vqKlzcl,https://open.spotify.com/track/1l06BAA8vssAu35vqKlzcl
Safety (feat. DJ Snake) - Dark Heart Darker Mix,Safety (The Dark Heart Remixes),"GASHI, DJ Snake, Dark Heart",5k99Qbp4cy1MrIh34QYzPY,https://open.spotify.com/track/5k99Qbp4cy1MrIh34QYzPY
Sing To Me,Sing To Me,"MISSIO, Death Stranding: Timefall",44oCGRuPFy7Uz6w4KliMBS,https://open.spotify.com/track/44oCGRuPFy7Uz6w4KliMBS
Came For The Low,Came For The Low,"ZHU, partywithray",36LQYp5FNsuT5voIO9bdfZ,https://open.spotify.com/track/36LQYp5FNsuT5voIO9bdfZ
Hot Water,Hot Water,"Audien, 3LAU, Victoria Zaro",36rVmexpQ7mUBZrvnkC88j,https://open.spotify.com/track/36rVmexpQ7mUBZrvnkC88j
20:25 - ReauBeau Remix,20:25 (ReauBeau Remix),"Flux Pavilion, What So Not, The Chain Gang Of 1974, ReauBeau",369Q0C2VQULzXTax3pCj4O,https://open.spotify.com/track/369Q0C2VQULzXTax3pCj4O
You Know You Like It,You Know You Like It,"DJ Snake, AlunaGeorge",57kR5SniQIbsbVoIjjOUDa,https://open.spotify.com/track/57kR5SniQIbsbVoIjjOUDa
Make It To Heaven (with Raye) - Rework,Make It To Heaven (with Raye) [Rework],"David Guetta, MORTEN, RAYE",5xv5YlwHeveuhd31bT21cN,https://open.spotify.com/track/5xv5YlwHeveuhd31bT21cN
Falling,Falling,Alesso,43mNwDn0zOH2HKl5B4aqcx,https://open.spotify.com/track/43mNwDn0zOH2HKl5B4aqcx
