title,album,artist,id,url
A Matter of Time,A Matter Of Time,Ben Böhmer,7DghZdBmY3GJT4vjq9dfUf,https://open.spotify.com/track/7DghZdBmY3GJT4vjq9dfUf
Burning Stones - Simon Patterson Remix,Burning Stones,"Astrix, Freedom Fighters, Simon Patterson",0XfAQS653sP3QhQp65VUYh,https://open.spotify.com/track/0XfAQS653sP3QhQp65VUYh
CHIMERICAL,Bloom,Roniit,4TAHckckV2mCVahpkOPZWk,https://open.spotify.com/track/4TAHckckV2mCVahpkOPZWk
Disappear (feat. Hayley Trinca) [ShockOne Remix],Disappear (feat. Hayley Trinca) [ShockOne Remix],"Odd Mob, Pooks, ShockOne, Hayley Trinca",7JdHEhOa7CXs8oEBnMtnjh,https://open.spotify.com/track/7JdHEhOa7CXs8oEBnMtnjh
Followers,Followers,"AREA21, Martin Garrix, Maejor",5sPoju3oZHg9Wq5KXxBH3a,https://open.spotify.com/track/5sPoju3oZHg9Wq5KXxBH3a
GLORY,GLORY,"The Worst of Us, ALEX",7KsEuuofjyZaLSZWfImkev,https://open.spotify.com/track/7KsEuuofjyZaLSZWfImkev
Girl - Extended Mix,Girl,Fabrication,1Ep6ULp2U4gvliBFWC4pTu,https://open.spotify.com/track/1Ep6ULp2U4gvliBFWC4pTu
Group Therapy (Messages Pt. 3) [ABGT447],Group Therapy 447,Above & Beyond,1Yo8kt8lyWBKXjM1R4M0v9,https://open.spotify.com/track/1Yo8kt8lyWBKXjM1R4M0v9
Hero (feat. Luxtides) - Acoustic Version,Hero (feat. Luxtides) [Acoustic Version],"Afrojack, David Guetta, Luxtides",6xfRja1dID0cecpkiB58ee,https://open.spotify.com/track/6xfRja1dID0cecpkiB58ee
If You Really Love Me (How Will I Know) - MistaJam Remix,If You Really Love Me (How Will I Know) [MistaJam Remix],"David Guetta, MistaJam, John Newman",2Mz3ItTbNe5NxgFA4C5Qfg,https://open.spotify.com/track/2Mz3ItTbNe5NxgFA4C5Qfg
Jump Start,Walker Racing League,Alan Walker,3eGpOTv2ZHD68SX6hxRPNM,https://open.spotify.com/track/3eGpOTv2ZHD68SX6hxRPNM
Lil Mama,Lil Mama,"partywithray, ZHU",44GPmiM2FZjxzFXbeQ4Ovl,https://open.spotify.com/track/44GPmiM2FZjxzFXbeQ4Ovl
Losing My Mind (with Elohim),Losing My Mind (with Elohim),"Party Favor, Elohim",4uklTQyZiktk2DExXMRHZk,https://open.spotify.com/track/4uklTQyZiktk2DExXMRHZk
Monstercat Silk Showcase 612 (Hosted by Jayeson Andel),Monstercat Silk Showcase 612 (Hosted by Jayeson Andel),Monstercat Silk Showcase,6OetTNSgXA1BjVzZsMNjID,https://open.spotify.com/track/6OetTNSgXA1BjVzZsMNjID
More More More,More More More,"Apashe, Lubalin",3yAWHGiPLb9xkZ6eJokHrp,https://open.spotify.com/track/3yAWHGiPLb9xkZ6eJokHrp
Music Means Love Forever,Music Means Love Forever,"Steve Aoki, Armin van Buuren",4LlhYmenqKC0boXvDpl6vt,https://open.spotify.com/track/4LlhYmenqKC0boXvDpl6vt
Potions,Potions,"LSDREAM, Liquid Stranger",1PTbEooTqwpzCPvbx9zJWr,https://open.spotify.com/track/1PTbEooTqwpzCPvbx9zJWr
Saber Athena (Tritonia 354),Tritonia 354,"Adz, Harry Diamond, Lyonheart",3WDOyWPi8fSkOhBC4G9M8W,https://open.spotify.com/track/3WDOyWPi8fSkOhBC4G9M8W
Shadows - Maor Levi Remix,Shadows (Maor Levi Remix),"Seven Lions, Wooli, Amidy, Maor Levi",0ywInm0GDnsZwqz8LbfgMB,https://open.spotify.com/track/0ywInm0GDnsZwqz8LbfgMB
Soul Trippin',Soul Trippin',Malaa,7wVcPkPP2eLTb1f1Z5D8g0,https://open.spotify.com/track/7wVcPkPP2eLTb1f1Z5D8g0
Steifell (Things I Never Said),Steifell (Things I Never Said),"Moon Rush, Meggie York",6FHtlWje7USbaSNqcINF9B,https://open.spotify.com/track/6FHtlWje7USbaSNqcINF9B
Symphony,Symphony,Foxhunt,6VKrP7RPGECy3cOfVoluKC,https://open.spotify.com/track/6VKrP7RPGECy3cOfVoluKC
Symphony - Helsloot Remix,Symphony (Helsloot Remix),"Flux Pavilion, Layna, Helsloot",4PCctAsE7aOdyOZnYzPbdz,https://open.spotify.com/track/4PCctAsE7aOdyOZnYzPbdz
The Dawn Is Still Dark,The Dawn Is Still Dark,Laura Brehm,524odjkcZSv0nlXox7P1PM,https://open.spotify.com/track/524odjkcZSv0nlXox7P1PM
Thunder,Shadowlands (Inspired by ‘The Outlaw Ocean’ a book by Ian Urbina),"Pegboard Nerds, Ian Urbina",3FDHFdEvPnyQeP9enMlal4,https://open.spotify.com/track/3FDHFdEvPnyQeP9enMlal4
Time Machine,Time Machine,TOKYO ROSE,72aTdMo8qCz7YiyekagY8O,https://open.spotify.com/track/72aTdMo8qCz7YiyekagY8O
Touhou Riddim,Simulation,Virtual Riot,0tgDQtFDQD9Q9CdBXO9pln,https://open.spotify.com/track/0tgDQtFDQD9Q9CdBXO9pln
Toys of Violence,Toys of Violence,No Mana,1N563IecqKHVdQYsGQ0DYp,https://open.spotify.com/track/1N563IecqKHVdQYsGQ0DYp
Treading Water - CloudNone Remix,Treading Water (CloudNone Remix),"Said The Sky, CloudNone",1Aus6BxJnG9lDg364fe7Nd,https://open.spotify.com/track/1Aus6BxJnG9lDg364fe7Nd
Zombies Ate My Ravers,Zombies Ate My Ravers,"Figure, MDK",3bjaRu9cJZ4W1J41G6y65i,https://open.spotify.com/track/3bjaRu9cJZ4W1J41G6y65i
